{
  "id": "018f3c2a-c001-7000-a1b2-c3d4e5f60001",
  "student_id": "018f3c2a-7000-7000-a1b2-c3d4e5f60001",
  "consenter_name": "Martha Shei",
  "relationship": "mother",
  "consenter_contact": "+237670000001",
  "consented_at": "2026-06-01T08:15:00Z",
  "scope": ["academic_records", "photo_on_id", "parent_portal"],
  "version": 1,
  "revoked_at": null
}
